[
  {
    "entity_id": "contact-001",
    "field": "name",
    "local_value": "Local Name 1",
    "remote_value": "Remote Name 1",
    "local_timestamp": "2024-01-15T10:01:40Z",
    "remote_timestamp": "2024-01-15T10:01:40Z",
    "resolution": "remote_wins",
    "resolution_reason": "exact_timestamp_tie_tie_breaker_remote_wins"
  },
  {
    "entity_id": "contact-002",
    "field": "name",
    "local_value": "Local Name 2",
    "remote_value": "Remote Name 2",
    "local_timestamp": "2024-01-15T10:01:40Z",
    "remote_timestamp": "2024-01-15T10:01:40Z",
    "resolution": "remote_wins",
    "resolution_reason": "exact_timestamp_tie_tie_breaker_remote_wins"
  },
  {
    "entity_id": "contact-003",
    "field": "name",
    "local_value": "Local Name 3",
    "remote_value": "Remote Name 3",
    "local_timestamp": "2024-01-15T10:01:40Z",
    "remote_timestamp": "2024-01-15T10:01:40Z",
    "resolution": "remote_wins",
    "resolution_reason": "exact_timestamp_tie_tie_breaker_remote_wins"
  },
  {
    "entity_id": "contact-004",
    "field": "name",
    "local_value": "Local Name 4",
    "remote_value": "Remote Name 4",
    "local_timestamp": "2024-01-15T10:01:40Z",
    "remote_timestamp": "2024-01-15T10:01:40Z",
    "resolution": "remote_wins",
    "resolution_reason": "exact_timestamp_tie_tie_breaker_remote_wins"
  },
  {
    "entity_id": "contact-005",
    "field": "name",
    "local_value": "Local Name 5",
    "remote_value": "Remote Name 5",
    "local_timestamp": "2024-01-15T10:01:40Z",
    "remote_timestamp": "2024-01-15T10:01:40Z",
    "resolution": "remote_wins",
    "resolution_reason": "exact_timestamp_tie_tie_breaker_remote_wins"
  },
  {
    "entity_id": "contact-011",
    "field": "deleted",
    "local_value": "true",
    "remote_value": "false",
    "local_timestamp": "2024-01-15T10:03:20Z",
    "remote_timestamp": "2024-01-15T10:04:10Z",
    "resolution": "remote_wins",
    "resolution_reason": "remote_timestamp_later"
  }
]
