[
  {
    "entity_id": "contact-021",
    "field": "name",
    "local_value": "Person 021",
    "remote_value": "Person 021",
    "local_timestamp": "2024-01-15T10:01:00Z",
    "remote_timestamp": "2024-01-15T10:01:00Z",
    "resolution": "remote_wins",
    "resolution_reason": "exact_timestamp_tie_tie_breaker_remote_wins"
  },
  {
    "entity_id": "contact-021",
    "field": "phone",
    "local_value": "+1-555-LOCAL-21",
    "remote_value": "+1-555-1021",
    "local_timestamp": "2024-01-15T10:01:10Z",
    "remote_timestamp": "2024-01-15T10:01:30Z",
    "resolution": "remote_wins",
    "resolution_reason": "remote_timestamp_later"
  },
  {
    "entity_id": "contact-022",
    "field": "name",
    "local_value": "Person 022",
    "remote_value": "Person 022",
    "local_timestamp": "2024-01-15T10:02:00Z",
    "remote_timestamp": "2024-01-15T10:02:00Z",
    "resolution": "remote_wins",
    "resolution_reason": "exact_timestamp_tie_tie_breaker_remote_wins"
  },
  {
    "entity_id": "contact-022",
    "field": "phone",
    "local_value": "+1-555-LOCAL-22",
    "remote_value": "+1-555-1022",
    "local_timestamp": "2024-01-15T10:02:10Z",
    "remote_timestamp": "2024-01-15T10:02:30Z",
    "resolution": "remote_wins",
    "resolution_reason": "remote_timestamp_later"
  },
  {
    "entity_id": "contact-023",
    "field": "name",
    "local_value": "Person 023",
    "remote_value": "Person 023",
    "local_timestamp": "2024-01-15T10:03:00Z",
    "remote_timestamp": "2024-01-15T10:03:00Z",
    "resolution": "remote_wins",
    "resolution_reason": "exact_timestamp_tie_tie_breaker_remote_wins"
  },
  {
    "entity_id": "contact-023",
    "field": "phone",
    "local_value": "+1-555-LOCAL-23",
    "remote_value": "+1-555-1023",
    "local_timestamp": "2024-01-15T10:03:10Z",
    "remote_timestamp": "2024-01-15T10:03:30Z",
    "resolution": "remote_wins",
    "resolution_reason": "remote_timestamp_later"
  },
  {
    "entity_id": "contact-024",
    "field": "name",
    "local_value": "Person 024",
    "remote_value": "Person 024",
    "local_timestamp": "2024-01-15T10:04:00Z",
    "remote_timestamp": "2024-01-15T10:04:00Z",
    "resolution": "remote_wins",
    "resolution_reason": "exact_timestamp_tie_tie_breaker_remote_wins"
  },
  {
    "entity_id": "contact-024",
    "field": "phone",
    "local_value": "+1-555-LOCAL-24",
    "remote_value": "+1-555-1024",
    "local_timestamp": "2024-01-15T10:04:10Z",
    "remote_timestamp": "2024-01-15T10:04:30Z",
    "resolution": "remote_wins",
    "resolution_reason": "remote_timestamp_later"
  },
  {
    "entity_id": "contact-025",
    "field": "name",
    "local_value": "Person 025",
    "remote_value": "Person 025",
    "local_timestamp": "2024-01-15T10:05:00Z",
    "remote_timestamp": "2024-01-15T10:05:00Z",
    "resolution": "remote_wins",
    "resolution_reason": "exact_timestamp_tie_tie_breaker_remote_wins"
  },
  {
    "entity_id": "contact-025",
    "field": "phone",
    "local_value": "+1-555-LOCAL-25",
    "remote_value": "+1-555-1025",
    "local_timestamp": "2024-01-15T10:05:10Z",
    "remote_timestamp": "2024-01-15T10:05:30Z",
    "resolution": "remote_wins",
    "resolution_reason": "remote_timestamp_later"
  },
  {
    "entity_id": "contact-026",
    "field": "name",
    "local_value": "Person 026",
    "remote_value": "Person 026",
    "local_timestamp": "2024-01-15T10:06:00Z",
    "remote_timestamp": "2024-01-15T10:06:00Z",
    "resolution": "remote_wins",
    "resolution_reason": "exact_timestamp_tie_tie_breaker_remote_wins"
  },
  {
    "entity_id": "contact-026",
    "field": "phone",
    "local_value": "+1-555-LOCAL-26",
    "remote_value": "+1-555-1026",
    "local_timestamp": "2024-01-15T10:06:10Z",
    "remote_timestamp": "2024-01-15T10:06:30Z",
    "resolution": "remote_wins",
    "resolution_reason": "remote_timestamp_later"
  },
  {
    "entity_id": "contact-027",
    "field": "name",
    "local_value": "Person 027",
    "remote_value": "Person 027",
    "local_timestamp": "2024-01-15T10:07:00Z",
    "remote_timestamp": "2024-01-15T10:07:00Z",
    "resolution": "remote_wins",
    "resolution_reason": "exact_timestamp_tie_tie_breaker_remote_wins"
  },
  {
    "entity_id": "contact-027",
    "field": "phone",
    "local_value": "+1-555-LOCAL-27",
    "remote_value": "+1-555-1027",
    "local_timestamp": "2024-01-15T10:07:10Z",
    "remote_timestamp": "2024-01-15T10:07:30Z",
    "resolution": "remote_wins",
    "resolution_reason": "remote_timestamp_later"
  },
  {
    "entity_id": "contact-028",
    "field": "name",
    "local_value": "Person 028",
    "remote_value": "Person 028",
    "local_timestamp": "2024-01-15T10:08:00Z",
    "remote_timestamp": "2024-01-15T10:08:00Z",
    "resolution": "remote_wins",
    "resolution_reason": "exact_timestamp_tie_tie_breaker_remote_wins"
  },
  {
    "entity_id": "contact-028",
    "field": "phone",
    "local_value": "+1-555-LOCAL-28",
    "remote_value": "+1-555-1028",
    "local_timestamp": "2024-01-15T10:08:10Z",
    "remote_timestamp": "2024-01-15T10:08:30Z",
    "resolution": "remote_wins",
    "resolution_reason": "remote_timestamp_later"
  },
  {
    "entity_id": "contact-029",
    "field": "name",
    "local_value": "Person 029",
    "remote_value": "Person 029",
    "local_timestamp": "2024-01-15T10:09:00Z",
    "remote_timestamp": "2024-01-15T10:09:00Z",
    "resolution": "remote_wins",
    "resolution_reason": "exact_timestamp_tie_tie_breaker_remote_wins"
  },
  {
    "entity_id": "contact-029",
    "field": "phone",
    "local_value": "+1-555-LOCAL-29",
    "remote_value": "+1-555-1029",
    "local_timestamp": "2024-01-15T10:09:10Z",
    "remote_timestamp": "2024-01-15T10:09:30Z",
    "resolution": "remote_wins",
    "resolution_reason": "remote_timestamp_later"
  },
  {
    "entity_id": "contact-030",
    "field": "name",
    "local_value": "Person 030",
    "remote_value": "Person 030",
    "local_timestamp": "2024-01-15T10:10:00Z",
    "remote_timestamp": "2024-01-15T10:10:00Z",
    "resolution": "remote_wins",
    "resolution_reason": "exact_timestamp_tie_tie_breaker_remote_wins"
  },
  {
    "entity_id": "contact-030",
    "field": "phone",
    "local_value": "+1-555-LOCAL-30",
    "remote_value": "+1-555-1030",
    "local_timestamp": "2024-01-15T10:10:10Z",
    "remote_timestamp": "2024-01-15T10:10:30Z",
    "resolution": "remote_wins",
    "resolution_reason": "remote_timestamp_later"
  }
]
